{
  "version": 1,
  "time": {
    "real_seconds_per_game_hour": 3.0
  },
  "calendar": {
    "hours_per_day": 24,
    "days_per_week": 7,
    "days_per_month": 28,
    "months_per_year": 12
  },
  "speed_presets": {
    "x1": 1.0,
    "x2": 2.0,
    "x6": 6.0,
    "x96": 96.0
  },
  "speed_range": {
    "min": 1.0,
    "max": 96.0
  }
}
